-------------------------------------------- SET ----------------------------------------------------------
-- Simple assigning ------------------------
-- Set variable
SET @var_int := (SELECT 53);
-- Set multiple variables at once of different types
SET @var_string := 'Text',
    @var_null := NULL,
    @var_date := '2024-05-01',
    @var_array := ARRAY [1,5,3,4],
    @var_int_sci := 7e-5;
-- Selection plus operations with values
SELECT @var_int,
       @var_int + 5,
       @var_int_sci,
       @var_null,
       @var_int IS NULL,
       @var_null IS NULL,
       @var_string,
       @var_string || ' Concat',
       @var_date,
       @var_date::DATE + '1 MONTH'::INTERVAL,
       @var_array,
       @var_array[2:3],
       (@var_array::ANYARRAY)[2];
 @var_int | ?column? | @var_int_sci | @var_null | ?column? | ?column? | @var_string |  ?column?   | @var_date  |         ?column?         | @var_array | @var_array | @var_array 
----------+----------+--------------+-----------+----------+----------+-------------+-------------+------------+--------------------------+------------+------------+------------
       53 |       58 |      0.00007 |           | f        | t        | Text        | Text Concat | 2024-05-01 | Sat Jun 01 00:00:00 2024 | {1,5,3,4}  | {5,3}      |          5
(1 row)

-- Check that the variable values stayed the same
SELECT @var_string,
       @var_int,
       @var_int_sci,
       @var_null,
       @var_date,
       @var_array;
 @var_string | @var_int | @var_int_sci | @var_null | @var_date  | @var_array 
-------------+----------+--------------+-----------+------------+------------
 Text        |       53 |      0.00007 |           | 2024-05-01 | {1,5,3,4}
(1 row)

-- empty string
SET @a := '';
SELECT @a;
 @a 
----
 
(1 row)

SET @a := (5, 2);
SELECT @a;
  @a   
-------
 (5,2)
(1 row)

SET @a := test; -- should fail
ERROR:  column "test" does not exist
LINE 1: SET @a := test;
                  ^
SET @gs := GENERATE_SERIES(1, 5, 10); -- should fail
ERROR:  set-valued function called in context that cannot accept a set
LINE 1: SET @gs := GENERATE_SERIES(1, 5, 10);
                   ^
-- Self assigning --------------------------
SET @var := 5;
SET @var := (@var * @var) + @var - 1;
SELECT @var;
 @var 
------
   29
(1 row)

SET @sa := @sa + 1; -- should fail
ERROR:  session variable "@sa" does not exist
SET @sa := @nonexistent; -- should fail
ERROR:  session variable "@nonexistent" does not exist
    
SELECT @sa; -- should fail
ERROR:  session variable "@sa" does not exist
        
-- Assigning from variables initiated earlier in the chain
--
-- Thanks to the pstate->sesvar_changes we don't have to add typecast to
-- @char_int * @created_int previously gained expr types will be assigned to them ->
-- this way parser knows @created_int is an INT even though it has not yet been saved in memory
-- (the variable is still "not existing" at this point -> if it crashes it won't be saved logically).
SET @char_int := '5',
    @created_int := @char_int + 3,
    @multiple := @char_int * @created_int;
SELECT @char_int,
       @created_int,
       @multiple;
 @char_int | @created_int | @multiple 
-----------+--------------+-----------
 5         |            8 |        40
(1 row)

SET @a := 1,
    @a := 'Text',
    @a := '2024-01-01'::DATE;
SELECT @a;
     @a     
------------
 01-01-2024
(1 row)

SET @num := '5',
    @int := 5.5,
    @res := @num * @int;
SELECT @res;
 @res 
------
 27.5
(1 row)

SET @num := '5.5', -- should fail -> Tries to coerce to INT not NUMERIC 
    @int := 5,
    @res := @num * @int;
ERROR:  invalid input syntax for type integer: "5.5"
-- Overwrites everything before the ERROR
SELECT @num, @int, @res;
 @num | @int | @res 
------+------+------
 5.5  |    5 | 27.5
(1 row)

-- Variable name length --------------------
-- @ + 62 length is OK
SET @X2345678901234567890123456789012345678901234567890123456789012 := 12;
SELECT @x2345678901234567890123456789012345678901234567890123456789012 := 12;
 @x2345678901234567890123456789012345678901234567890123456789012 
-----------------------------------------------------------------
                                                              12
(1 row)

SELECT @x2345678901234567890123456789012345678901234567890123456789012;
 @x2345678901234567890123456789012345678901234567890123456789012 
-----------------------------------------------------------------
                                                              12
(1 row)

-- @ + 63 should be TRUNCATED
SET @X23456789012345678901234567890123456789012345678901234567890123 := 12;
NOTICE:  identifier "@x23456789012345678901234567890123456789012345678901234567890123" will be truncated to "@x2345678901234567890123456789012345678901234567890123456789012"
SELECT @x23456789012345678901234567890123456789012345678901234567890123 := 12;
NOTICE:  identifier "@x23456789012345678901234567890123456789012345678901234567890123" will be truncated to "@x2345678901234567890123456789012345678901234567890123456789012"
 @x2345678901234567890123456789012345678901234567890123456789012 
-----------------------------------------------------------------
                                                              12
(1 row)

SELECT @x23456789012345678901234567890123456789012345678901234567890123;
NOTICE:  identifier "@x23456789012345678901234567890123456789012345678901234567890123" will be truncated to "@x2345678901234567890123456789012345678901234567890123456789012"
 @x2345678901234567890123456789012345678901234567890123456789012 
-----------------------------------------------------------------
                                                              12
(1 row)

-- Type ------------------------------------
-- Number by default but convertible to text
SET @num := 5;
SELECT @num;
 @num 
------
    5
(1 row)

SELECT @num::TEXT;
 @num 
------
 5
(1 row)

-- Other way around as well
SET @num := '5';
SELECT @num;
 @num 
------
 5
(1 row)

SELECT @num::INT;
 @num 
------
    5
(1 row)

-- Remember inline types
SET @dat := '2024-01-01'::DATE,
    @intv := '1 MONTH'::INTERVAL,
    @res := @dat + @intv;
SELECT @dat, @intv, @res;
    @dat    |  @intv  |           @res           
------------+---------+--------------------------
 01-01-2024 | @ 1 mon | Thu Feb 01 00:00:00 2024
(1 row)

SET @dat := CAST('2024-01-01' AS DATE),
    @intv := CAST('1 MONTH' AS INTERVAL),
    @res := @dat + @intv;
SELECT @dat, @intv, @res;
    @dat    |  @intv  |           @res           
------------+---------+--------------------------
 01-01-2024 | @ 1 mon | Thu Feb 01 00:00:00 2024
(1 row)

-- Type handling
CREATE TYPE TEST_TYPE AS
(
    a INT,
    b TEXT
);
SET @typ := (5, 'ahoj');
SELECT @typ, (@typ::TEST_TYPE).a, (@typ::TEST_TYPE).b;
   @typ   | a |  b   
----------+---+------
 (5,ahoj) | 5 | ahoj
(1 row)

SELECT (@typ).a; -- should fail
ERROR:  could not identify column "a" in record data type
LINE 1: SELECT (@typ).a;
        ^
SET @typ := (5, 'ahoj')::TEST_TYPE;
SELECT @typ, (@typ).a, (@typ).b, (@typ).*;
   @typ   | a |  b   | a |  b   
----------+---+------+---+------
 (5,ahoj) | 5 | ahoj | 5 | ahoj
(1 row)

SELECT @typ.a; -- should fail
ERROR:  syntax error at or near "."
LINE 1: SELECT @typ.a;
                   ^
SET @t := (@typ).*; -- should fail
ERROR:  row expansion via "*" is not supported here
LINE 1: SET @t := (@typ).*;
        ^
SET @arr := ARRAY [8, 4 , 5];
SELECT (@arr)[2];
 @arr 
------
    4
(1 row)

SELECT @arr[2], @arr, @arr[2:3];
 @arr |  @arr   | @arr  
------+---------+-------
    4 | {8,4,5} | {4,5}
(1 row)

SET @arr := '{5,2,3}'::INT [];
SELECT @arr[1];
 @arr 
------
    5
(1 row)

SET @arr := '{5,2,3}';
SELECT @arr[1]; -- should fail -> we don't want to guess the type of array
ERROR:  cannot subscript type unknown because it does not support subscripting
LINE 1: SELECT @arr[1];
        ^
SET @arr := 5;
SELECT @arr[2]; -- should fail -> not an array
ERROR:  cannot subscript type integer because it does not support subscripting
LINE 1: SELECT @arr[2];
        ^
SELECT @arr := '{3,2,5}'::INT[], @arr[1];
  @arr   | @arr 
---------+------
 {3,2,5} |    3
(1 row)

SELECT @arr[1] := 4;
 @arr 
------
    4
(1 row)

SET @arr[2] := '4';
SELECT @arr, @arr[1], @arr[2:3];
  @arr   | @arr | @arr  
---------+------+-------
 {4,4,5} |    4 | {4,5}
(1 row)

SET @arr[1:2] := 5;
SELECT @arr;
  @arr   
---------
 {5,5,5}
(1 row)

SET @arr := ARRAY [(5, 'ahoj')::TEST_TYPE, (3, 'jakje')::TEST_TYPE];
SELECT @arr, (@arr[1]).a, (@arr[1]).b;
           @arr           | a |  b   
--------------------------+---+------
 {"(5,ahoj)","(3,jakje)"} | 5 | ahoj
(1 row)

SELECT @arr[1] := 'Hello'; -- should fail
ERROR:  Invalid type of expression.
SELECT @arr[1] := NULL; -- should fail
ERROR:  Can not assign NULL value as an array item
SET @arr[4] := 4; -- should fail
ERROR:  Array indirection out of bounds.
SET @arr[-1] := 4; -- should fail
ERROR:  Array indirection out of bounds.
SELECT @arr_non_existent[1] := 5; -- should fail
ERROR:  Can not use array indirection on non-existing value.
SET @js := '{"col": "value"}'::JSON;
SELECT @js ->> 'col';
 ?column? 
----------
 value
(1 row)

SET @js := '{"col": "value"}';
SELECT @js::JSON ->> 'col';
 ?column? 
----------
 value
(1 row)

SELECT @js ->> 'col'; -- should fail
ERROR:  operator is not unique: unknown ->> unknown
LINE 1: SELECT @js ->> 'col';
                   ^
HINT:  Could not choose a best candidate operator. You might need to add explicit type casts.
-- Collation -------------------------------
SET @txt1 := 'test', @"TXT" := 'TEST';
SELECT @txt1 < @"TXT"; -- should fail
ERROR:  could not determine which collation to use for string comparison
HINT:  Use the COLLATE clause to set the collation explicitly.
SELECT @txt1 < @"TXT" COLLATE "POSIX";
 ?column? 
----------
 f
(1 row)

SELECT @txt1 < @"TXT"; -- should fail
ERROR:  could not determine which collation to use for string comparison
HINT:  Use the COLLATE clause to set the collation explicitly.
SET @"TXT" := 'TEST' COLLATE "POSIX";
SELECT @txt1 < @"TXT";
 ?column? 
----------
 f
(1 row)

-- Un/Quoted names -------------------------
SET @TEST := 2, @test := 5, @"Test" := 3, @"Te.St" := 4;
SELECT @TEST, @test, @"Test", @"Te.St";
 @test | @test | @Test | @Te.St 
-------+-------+-------+--------
     5 |     5 |     3 |      4
(1 row)

SELECT @"tEST"; -- should fail
ERROR:  session variable "@tEST" does not exist
SET "@t" := 5; -- should fail
ERROR:  syntax error at or near ":="
LINE 1: SET "@t" := 5;
                 ^
SET @"@t" := 5,
    @"5 name starting with number and spaces." := 3,
    @"Quoted-special | 'test' ;" := 1,
    @"-" := 0,
    @d_s3 := '';
SELECT @"@t",
       @"5 name starting with number and spaces.",
       @"Quoted-special | 'test' ;",
       @"-",
       @d_s3;
 @@t | @5 name starting with number and spaces. | @Quoted-special | 'test' ; | @- | @d_s3 
-----+------------------------------------------+----------------------------+----+-------
   5 |                                        3 |                          1 |  0 | 
(1 row)

SET @5ds := ''; -- should fail
ERROR:  syntax error at or near "@"
LINE 1: SET @5ds := '';
            ^
SET @@ds := ''; -- should fail
ERROR:  syntax error at or near "@@"
LINE 1: SET @@ds := '';
            ^
SET @ds@ := ''; -- should fail
ERROR:  syntax error at or near "@"
LINE 1: SET @ds@ := '';
               ^
SET @"" := ''; -- should fail
ERROR:  zero-length delimited session variable at or near "@"""
LINE 1: SET @"" := '';
            ^
SET @ := ''; -- should fail
ERROR:  syntax error at or near "@"
LINE 1: SET @ := '';
            ^
    
-------------------------------------------- PREPARE DATA -----------------------------------------------
-- DDL
CREATE TABLE test
(
    col_int  INTEGER,
    col_char VARCHAR(32)
);
-- DML
INSERT INTO test (col_int, col_char)
VALUES (@char_int, @char_int),
       (@multiple / @char_int, @var_string || ' Concat'),
       (6, '5'),
       (6, '5'),
       (6, 'Blocker'),
       (6, 'Blocker'),
       (6, '5'),
       (6, '5'),
       (6, '5');
-------------------------------------------- SELECT -----------------------------------------------------
-- SELECT simple assign
SELECT @var_int := 53;
 @var_int 
----------
       53
(1 row)

SELECT @var_string := 'Text',
       @var_null := NULL,
       @var_date := '2024-05-01',
       @var_array := ARRAY [1,5,3,4];
 @var_string | @var_null | @var_date  | @var_array 
-------------+-----------+------------+------------
 Text        |           | 2024-05-01 | {1,5,3,4}
(1 row)

-- Selection plus operations with values
SELECT @var_int,
       @var_int + 5,
       @var_null,
       @var_string,
       @var_string || ' Concat',
       @var_date,
       @var_date::DATE + '1 MONTH'::INTERVAL,
       @var_array,
       (@var_array::ANYARRAY)[2];
 @var_int | ?column? | @var_null | @var_string |  ?column?   | @var_date  |         ?column?         | @var_array | @var_array 
----------+----------+-----------+-------------+-------------+------------+--------------------------+------------+------------
       53 |       58 |           | Text        | Text Concat | 2024-05-01 | Sat Jun 01 00:00:00 2024 | {1,5,3,4}  |          5
(1 row)

SELECT (@v := col_int) <> (@v := 6), col_int, @v
FROM test;
 ?column? | col_int | @v 
----------+---------+----
 t        |       5 |  6
 t        |       8 |  6
 f        |       6 |  6
 f        |       6 |  6
 f        |       6 |  6
 f        |       6 |  6
 f        |       6 |  6
 f        |       6 |  6
 f        |       6 |  6
(9 rows)

-- Type ------------------------------------
-- TEXT type coercion with concate operator
-- Used to cause bugs due to text being saved in SESVAR as UNKNOWNOID
-- but coerce works only with TEXTOID
SELECT @b := '.hoj'::TEXT;
  @b  
------
 .hoj
(1 row)

SELECT @b;
  @b  
------
 .hoj
(1 row)

SELECT 'A' || @b, 'A' || @b;
 ?column? | ?column? 
----------+----------
 A.hoj    | A.hoj
(1 row)

SELECT @b := '.hoj' || '.A';
   @b   
--------
 .hoj.A
(1 row)

SELECT 'A' || @b := '.hoj', 'A' || @b;
 ?column? | ?column? 
----------+----------
 A.hoj    | A.hoj
(1 row)

SELECT 'A' || @b := NULL, 'A' || @b;
 ?column? | ?column? 
----------+----------
          | 
(1 row)

SELECT @a := '5',
       @b := @a + 3,
       @c := @a * @b;
 @a | @b | @c 
----+----+----
 5  |  8 | 40
(1 row)

-- Remember inline types
SELECT @dat := '2024-01-01'::DATE,
       @intv := '1 MONTH'::INTERVAL,
       @res := @dat + @intv;
    @dat    |  @intv  |           @res           
------------+---------+--------------------------
 01-01-2024 | @ 1 mon | Thu Feb 01 00:00:00 2024
(1 row)

-- Moreover to sesvar inline type changes
SET @a := 0;
-- The col #3 must not give parser return type INT because we know it will be changed in col before
SELECT @a, @a := 'hello', @a, @a := 3, @a, @a := 'hello again';
 @a |  @a   |  @a   | @a | @a |     @a      
----+-------+-------+----+----+-------------
  0 | hello | hello |  3 |  3 | hello again
(1 row)

SELECT @a := 10,
       @b := 2,
       @a > @b,
       @a := '10',
       @b := 2,
       @a > @b,
       @a := 2,
       @b := 10,
       @a > @b,
       @a := '2',
       @b := '10',
       @a::INT > @b;
 @a | @b | ?column? | @a | @b | ?column? | @a | @b | ?column? | @a | @b | ?column? 
----+----+----------+----+----+----------+----+----+----------+----+----+----------
 10 |  2 | t        | 10 |  2 | t        |  2 | 10 | f        | 2  | 10 | f
(1 row)

SET @a := 0;
SELECT @a, @a := 'hello', @a, @a := 3, @a, @a := 'hello again' -- should fail;
FROM GENERATE_SERIES(1, 3, 1) num;
ERROR:  invalid input syntax for type integer: "hello again"
SET @a := 0;
SELECT @a, @a := 'hello', @a, @a := 3, @a
FROM GENERATE_SERIES(1, 3, 1) num;
 @a |  @a   |  @a   | @a | @a 
----+-------+-------+----+----
  0 | hello | hello |  3 |  3
  3 | hello | hello |  3 |  3
  3 | hello | hello |  3 |  3
(3 rows)

-- Expr inside expr ------------------------
SET @t1 := (@t2 := 1) + @t3 := 4;
SELECT @t1, @t2, @t3;
 @t1 | @t2 | @t3 
-----+-----+-----
   5 |   1 |   4
(1 row)

SET @t1 := @t2 := @t3 := 1;
SELECT @t1, @t2, @t3;
 @t1 | @t2 | @t3 
-----+-----+-----
   1 |   1 |   1
(1 row)

SELECT @t1 := (@t2 := 1) + @t3 := 4,
       @t1,
       @t2,
       @t3 * @t1;
 @t1 | @t1 | @t2 | ?column? 
-----+-----+-----+----------
   5 |   5 |   1 |       20
(1 row)

SELECT @t1 := (@t3 := @t2 := 5 + @t3 := 2) + (@t2 := (@t3) * 2) + @t2,
       @t2,
       @t2 := 2,
       @t3,
       @t3 := @t3 + @t2;
 @t1 | @t2 | @t2 | @t3 | @t3 
-----+-----+-----+-----+-----
  35 |  14 |   2 |   7 |   9
(1 row)

SELECT @t1 := @t2 := @t3 := 1, @t1, @t2, @t3;
 @t1 | @t1 | @t2 | @t3 
-----+-----+-----+-----
   1 |   1 |   1 |   1
(1 row)

SELECT @a := @a := @a := @a := @a := 5;
 @a 
----
  5
(1 row)

SELECT ((@v := 5) <> (@v := 6)) = (@v := TRUE), @v;
 ?column? | @v 
----------+----
 t        | t
(1 row)

-- Cumulative query ------------------------
SELECT @t1 := @t1 + (@t2 := @t2 * @t2), @t2 := @t2 + 1
FROM GENERATE_SERIES(1, 3, 1) num;
 @t1 | @t2 
-----+-----
   2 |   2
   6 |   5
  31 |  26
(3 rows)

SET @cum_int := 0,
    @cum_char := 'Hello';
SELECT @cum_int := @cum_int + num, @cum_char := @cum_char || ', hello again'
FROM GENERATE_SERIES(1, 5, 1) num;
 @cum_int |                               @cum_char                                
----------+------------------------------------------------------------------------
        1 | Hello, hello again
        3 | Hello, hello again, hello again
        6 | Hello, hello again, hello again, hello again
       10 | Hello, hello again, hello again, hello again, hello again
       15 | Hello, hello again, hello again, hello again, hello again, hello again
(5 rows)

SELECT @cum_int, @cum_char;
 @cum_int |                               @cum_char                                
----------+------------------------------------------------------------------------
       15 | Hello, hello again, hello again, hello again, hello again, hello again
(1 row)

SET @cum_int := 0,
    @cum_char := 'Hello';
SELECT @cum_int := @cum_int + col_int, @cum_char := @cum_char || ' ' || col_char
FROM test;
 @cum_int |                   @cum_char                   
----------+-----------------------------------------------
        5 | Hello 5
       13 | Hello 5 Text Concat
       19 | Hello 5 Text Concat 5
       25 | Hello 5 Text Concat 5 5
       31 | Hello 5 Text Concat 5 5 Blocker
       37 | Hello 5 Text Concat 5 5 Blocker Blocker
       43 | Hello 5 Text Concat 5 5 Blocker Blocker 5
       49 | Hello 5 Text Concat 5 5 Blocker Blocker 5 5
       55 | Hello 5 Text Concat 5 5 Blocker Blocker 5 5 5
(9 rows)

SELECT @c := 1, @c := @c + col_int, @c := 'Text', @c := @c || ' ' || col_char
FROM test;
 @c | @c |  @c  |        @c        
----+----+------+------------------
  1 |  6 | Text | Text 5
  1 |  9 | Text | Text Text Concat
  1 |  7 | Text | Text 5
  1 |  7 | Text | Text 5
  1 |  7 | Text | Text Blocker
  1 |  7 | Text | Text Blocker
  1 |  7 | Text | Text 5
  1 |  7 | Text | Text 5
  1 |  7 | Text | Text 5
(9 rows)

-- Usage in queries ------------------------
SET @char_int := '5',
    @created_int := @char_int + 3,
    @multiple := @char_int * @created_int;
    
-- WHERE clause
SELECT *
FROM test
WHERE col_int = @char_int
   OR col_int = @created_int;
 col_int |  col_char   
---------+-------------
       5 | 5
       8 | Text Concat
(2 rows)

SELECT *
FROM test
WHERE col_int IN (@char_int, @created_int);
 col_int |  col_char   
---------+-------------
       5 | 5
       8 | Text Concat
(2 rows)

SELECT *, @created_int, @created_int := 3
FROM test
WHERE col_int = @char_int
   OR col_int = @created_int := 6;
 col_int | col_char | @created_int | @created_int 
---------+----------+--------------+--------------
       5 | 5        |            8 |            3
       6 | 5        |            6 |            3
       6 | 5        |            6 |            3
       6 | Blocker  |            6 |            3
       6 | Blocker  |            6 |            3
       6 | 5        |            6 |            3
       6 | 5        |            6 |            3
       6 | 5        |            6 |            3
(8 rows)

SELECT *, @created_int
FROM test
WHERE col_int = @created_int := col_int;
 col_int |  col_char   | @created_int 
---------+-------------+--------------
       5 | 5           |            5
       8 | Text Concat |            8
       6 | 5           |            6
       6 | 5           |            6
       6 | Blocker     |            6
       6 | Blocker     |            6
       6 | 5           |            6
       6 | 5           |            6
       6 | 5           |            6
(9 rows)

-- FROM & LIMIT clause
SELECT *
FROM test t1
         JOIN test t2 ON t1.col_char = @char_int AND t2.col_int = @char_int + 1
LIMIT @char_int - 3;
 col_int | col_char | col_int | col_char 
---------+----------+---------+----------
       5 | 5        |       6 | 5
       5 | 5        |       6 | 5
(2 rows)

SELECT @char_int := 5,
       @txt := '';
 @char_int | @txt 
-----------+------
         5 | 
(1 row)

-- Expression madness
SELECT *, @char_int := @char_int + 1, @txt := @txt || 'S-'
FROM test t1
         JOIN test t2 ON t2.col_int < @char_int := @char_int + 1 AND (@txt := @txt || 'F-') IS NOT NULL
WHERE t2.col_int < @char_int := @char_int + 1
  AND (@txt := @txt || 'W-') IS NOT NULL
LIMIT @char_int := @char_int + 10 + COALESCE(NULLIF((@txt := @txt || 'L-') IS NOT NULL, TRUE), FALSE)::INT;
 col_int |  col_char   | col_int |  col_char   | @char_int |                 @txt                 
---------+-------------+---------+-------------+-----------+--------------------------------------
       5 | 5           |       5 | 5           |        18 | L-F-W-S-
       5 | 5           |       8 | Text Concat |        21 | L-F-W-S-S-
       5 | 5           |       6 | 5           |        24 | L-F-W-S-S-S-
       5 | 5           |       6 | 5           |        27 | L-F-W-S-S-S-S-
       5 | 5           |       6 | Blocker     |        30 | L-F-W-S-S-S-S-S-
       5 | 5           |       6 | Blocker     |        33 | L-F-W-S-S-S-S-S-S-
       5 | 5           |       6 | 5           |        36 | L-F-W-S-S-S-S-S-S-S-
       5 | 5           |       6 | 5           |        39 | L-F-W-S-S-S-S-S-S-S-S-
       5 | 5           |       6 | 5           |        42 | L-F-W-S-S-S-S-S-S-S-S-S-
       8 | Text Concat |       5 | 5           |        43 | L-F-W-S-S-S-S-S-S-S-S-S-S-
       8 | Text Concat |       8 | Text Concat |        44 | L-F-W-S-S-S-S-S-S-S-S-S-S-S-
       8 | Text Concat |       6 | 5           |        45 | L-F-W-S-S-S-S-S-S-S-S-S-S-S-S-
       8 | Text Concat |       6 | 5           |        46 | L-F-W-S-S-S-S-S-S-S-S-S-S-S-S-S-
       8 | Text Concat |       6 | Blocker     |        47 | L-F-W-S-S-S-S-S-S-S-S-S-S-S-S-S-S-
       8 | Text Concat |       6 | Blocker     |        48 | L-F-W-S-S-S-S-S-S-S-S-S-S-S-S-S-S-S-
(15 rows)

-- DDL & DML -------------------------------
CREATE TABLE tmp
(
    cc  INT,
    coo INT DEFAULT @df,
    co  INT DEFAULT @df := 2
);
INSERT INTO tmp (cc)
VALUES (@df := 1),
       (@df := 2),
       (@df := 3),
       (@df := 4);
SELECT *
FROM tmp;
 cc | coo | co 
----+-----+----
  1 |   1 |  2
  2 |   2 |  2
  3 |   3 |  2
  4 |   4 |  2
(4 rows)

SET @df := 'Text',
    @df2 := 5;
INSERT INTO tmp (cc)
VALUES (5); -- should fail
ERROR:  invalid input syntax for type integer: "Text"
INSERT INTO tmp (cc, coo)
VALUES (5, 5);
ALTER TABLE tmp
    ALTER COLUMN coo SET DEFAULT @df2;
ALTER TABLE tmp
    ALTER COLUMN co SET DEFAULT @df2 := 3;
INSERT INTO tmp (cc)
VALUES (@df2 := 6);
SELECT *
FROM tmp;
 cc | coo | co 
----+-----+----
  1 |   1 |  2
  2 |   2 |  2
  3 |   3 |  2
  4 |   4 |  2
  5 |   5 |  2
  6 |   6 |  3
(6 rows)

SET @tt := 0;
UPDATE tmp
SET co = @tt := @tt + coo
WHERE co = 2;
SELECT *, @tt
FROM tmp
ORDER BY cc;
 cc | coo | co | @tt 
----+-----+----+-----
  1 |   1 |  1 |  15
  2 |   2 |  3 |  15
  3 |   3 |  6 |  15
  4 |   4 | 10 |  15
  5 |   5 | 15 |  15
  6 |   6 |  3 |  15
(6 rows)

DELETE FROM tmp
WHERE co = @tt - 12;
SELECT *, @tt
FROM tmp
ORDER BY cc;
 cc | coo | co | @tt 
----+-----+----+-----
  1 |   1 |  1 |  15
  3 |   3 |  6 |  15
  4 |   4 | 10 |  15
  5 |   5 | 15 |  15
(4 rows)

CREATE TABLE tmp2
(
    cc  INT,
    coo INT DEFAULT @d
);
INSERT INTO tmp2 (cc)
VALUES (5); -- should fail
ERROR:  session variable "@d" does not exist
DROP TABLE tmp;
DROP TABLE tmp2;
-- Aggregated functions --------------------
SELECT @min_ci := @b := MIN(col_int) * 2, @max_ci := MAX(col_int) + @b, @b
FROM test;
 @min_ci | @max_ci | @b 
---------+---------+----
      10 |      18 | 10
(1 row)

SELECT col_char, @sum_ci := SUM(col_int)
FROM test
GROUP BY col_char;
  col_char   | @sum_ci 
-------------+---------
 Text Concat |       8
 5           |      35
 Blocker     |      12
(3 rows)

SELECT @sum_ci;
 @sum_ci 
---------
      12
(1 row)

SET @agg := 0;
SELECT @agg := @agg + col_int, @cnt := COUNT(*)
FROM test
GROUP BY 1;
 @agg | @cnt 
------+------
   43 |    1
   19 |    1
   37 |    1
    5 |    1
   31 |    1
   13 |    1
   25 |    1
   49 |    1
   55 |    1
(9 rows)

SELECT @agg, @cnt, @agg := 0;
 @agg | @cnt | @agg 
------+------+------
   55 |    1 |    0
(1 row)

SELECT @agg := @agg + col_int, @cnt := COUNT(*)
FROM test
GROUP BY @agg := @agg + col_int;
 @agg | @cnt 
------+------
   43 |    1
   19 |    1
   37 |    1
    5 |    1
   31 |    1
   13 |    1
   25 |    1
   49 |    1
   55 |    1
(9 rows)

SELECT @agg, @cnt, @agg := 0;
 @agg | @cnt | @agg 
------+------+------
   55 |    1 |    0
(1 row)

SELECT @agg := @agg + col_int, @cnt := COUNT(*)
FROM test
GROUP BY col_int;
 @agg | @cnt 
------+------
    5 |    1
   11 |    7
   19 |    1
(3 rows)

SELECT @agg, @cnt, @agg := 0;
 @agg | @cnt | @agg 
------+------+------
   19 |    1 |    0
(1 row)

SELECT @agg := col_int, @cnt := COUNT(*)
FROM test
GROUP BY 1;
 @agg | @cnt 
------+------
    5 |    1
    6 |    7
    8 |    1
(3 rows)

-- @agg works over the data being prepared for aggregation
-- @cnt saves the result of aggregation
-- It means that @agg and @cnt do NOT have to be from the same row
SELECT @agg, @cnt, @agg := 0;
 @agg | @cnt | @agg 
------+------+------
    6 |    1 |    0
(1 row)

SELECT @agg := col_int, @cnt := COUNT(*)
FROM test
GROUP BY col_int;
 @agg | @cnt 
------+------
    5 |    1
    6 |    7
    8 |    1
(3 rows)

SELECT @agg, @cnt, @agg := 0;
 @agg | @cnt | @agg 
------+------+------
    8 |    1 |    0
(1 row)

SET @a := 0;
SELECT col_int, @a, @a := @a + COUNT(*), COUNT(*), @a
FROM test
GROUP BY col_int;
 col_int | @a | @a | count | @a 
---------+----+----+-------+----
       5 |  0 |  1 |     1 |  1
       6 |  1 |  8 |     7 |  8
       8 |  8 |  9 |     1 |  9
(3 rows)

-------------------------------------------- EXPLAIN -----------------------------------------------------
EXPLAIN
SELECT @agg := @bgg := @agg + col_int, COUNT(*)
FROM test
GROUP BY 1
ORDER BY 1;
                            QUERY PLAN                             
-------------------------------------------------------------------
 Sort  (cost=32.57..33.07 rows=200 width=12)
   Sort Key: (@agg := @bgg := (@agg + col_int))
   ->  HashAggregate  (cost=22.42..24.92 rows=200 width=12)
         Group Key: @agg := @bgg := (@agg + col_int)
         ->  Seq Scan on test  (cost=0.00..18.88 rows=710 width=4)
(5 rows)

EXPLAIN
SELECT @agg := (@agg + col_int), COUNT(*)
FROM test
GROUP BY 1
ORDER BY 1 DESC;
                            QUERY PLAN                             
-------------------------------------------------------------------
 Sort  (cost=32.57..33.07 rows=200 width=12)
   Sort Key: (@agg := (@agg + col_int)) DESC
   ->  HashAggregate  (cost=22.42..24.92 rows=200 width=12)
         Group Key: @agg := (@agg + col_int)
         ->  Seq Scan on test  (cost=0.00..18.88 rows=710 width=4)
(5 rows)

EXPLAIN
SELECT @agg := col_int, COUNT(*)
FROM test
GROUP BY 1
ORDER BY 1;
                            QUERY PLAN                             
-------------------------------------------------------------------
 Sort  (cost=30.29..30.79 rows=200 width=12)
   Sort Key: (@agg := col_int)
   ->  HashAggregate  (cost=20.65..22.65 rows=200 width=12)
         Group Key: @agg := col_int
         ->  Seq Scan on test  (cost=0.00..17.10 rows=710 width=4)
(5 rows)

EXPLAIN
SELECT @agg := @bgg, COUNT(*)
FROM test
GROUP BY 1
ORDER BY 1;
                         QUERY PLAN                          
-------------------------------------------------------------
 GroupAggregate  (cost=0.00..18.89 rows=1 width=40)
   ->  Seq Scan on test  (cost=0.00..17.10 rows=710 width=0)
(2 rows)

EXPLAIN
SELECT @agg + col_int, COUNT(*)
FROM test
GROUP BY 1
ORDER BY 1 DESC;
                            QUERY PLAN                             
-------------------------------------------------------------------
 Sort  (cost=32.57..33.07 rows=200 width=12)
   Sort Key: ((@agg + col_int)) DESC
   ->  HashAggregate  (cost=22.42..24.92 rows=200 width=12)
         Group Key: (@agg + col_int)
         ->  Seq Scan on test  (cost=0.00..18.88 rows=710 width=4)
(5 rows)

-------------------------------------------- TRANSACTIONS -----------------------------------------------
-- More cases in PL/pgSQL part
SET @var := 1;
BEGIN;
SELECT @var;
 @var 
------
    1
(1 row)

SET @var := 'Changed';
ROLLBACK;
SELECT @var;
  @var   
---------
 Changed
(1 row)

-------------------------------------------- PREPARED STMT ----------------------------------------------
SELECT @a := @a := 5;
 @a 
----
  5
(1 row)

PREPARE s1 AS SELECT $1 + @a;
EXECUTE s1(@a);
 ?column? 
----------
       10
(1 row)

SET @a := 15;
EXECUTE s1(@a);
 ?column? 
----------
       30
(1 row)

DEALLOCATE s1;
PREPARE s2 AS SELECT $1 + @a := 5 + $2;
EXECUTE s2(@a, 2);
 ?column? 
----------
       22
(1 row)

SELECT @a;
 @a 
----
  7
(1 row)

DEALLOCATE s2;
-------------------------------------------- PL/pgSQL ---------------------------------------------------
-- DO BLOCKS -------------------------------
SET @pl := 5;
DO
$$
    DECLARE
    BEGIN
        SET @pl := 3;
        ROLLBACK;
    END;
$$ LANGUAGE plpgsql;
SELECT @pl;
 @pl 
-----
   3
(1 row)

DO
$$
    DECLARE
        a INT := 3;
    BEGIN
        SET @pl := a + 3;
    END;
$$ LANGUAGE plpgsql;
SELECT @pl;
 @pl 
-----
   6
(1 row)

SET @pl := 0;
DO
$$
    DECLARE
        i INT;
    BEGIN
        FOR i IN 1..5
            LOOP
                SET @pl := @pl + i;
            END LOOP;
    END;
$$ LANGUAGE plpgsql;
SELECT @pl;
 @pl 
-----
  15
(1 row)

SET @pl := 0;
DO
$$
    DECLARE
        rec RECORD;
    BEGIN
        FOR rec IN SELECT col_int
                   FROM test
            LOOP
                SET @pl := @pl + rec.col_int;
            END LOOP;
    END;
$$ LANGUAGE plpgsql;
SELECT @pl;
 @pl 
-----
  55
(1 row)

-- PROCEDURES ------------------------------
CREATE OR REPLACE PROCEDURE set_session_variables()
AS
$$
DECLARE
BEGIN
    SET @pl := 1;
END;
$$ LANGUAGE plpgsql;
CALL set_session_variables();
SELECT @pl;
 @pl 
-----
   1
(1 row)

DROP PROCEDURE set_session_variables();
CREATE OR REPLACE PROCEDURE set_session_variables_param(a INT)
AS
$$
DECLARE
BEGIN
    SET @pl := 1 + a;
END;
$$ LANGUAGE plpgsql;
CALL set_session_variables_param(5);
SELECT @pl;
 @pl 
-----
   6
(1 row)

DROP PROCEDURE set_session_variables_param;
-- FUNCTIONS -------------------------------
-- Make sure SESVAR is given to the argument by value to not access freed pointer later on
SET @plpgsql_sv_v := 'abc';
CREATE FUNCTION ffunc()
    RETURNS TEXT AS
$$
BEGIN
    RETURN gfunc(@plpgsql_sv_v);
END
$$ LANGUAGE plpgsql;
CREATE FUNCTION gfunc(t TEXT)
    RETURNS TEXT AS
$$
BEGIN
    SET @plpgsql_sv_v := 'BOOM!';
    RETURN t;
END;
$$ LANGUAGE plpgsql;
SELECT ffunc();
 ffunc 
-------
 abc
(1 row)

DROP FUNCTION gfunc;
DROP FUNCTION ffunc;
CREATE OR REPLACE FUNCTION overloaded_text_numeric(str TEXT)
    RETURNS TEXT
AS
$$
BEGIN
    RETURN str || ' Append text';
END;
$$ LANGUAGE plpgsql;
CREATE OR REPLACE FUNCTION overloaded_text_numeric(str NUMERIC)
    RETURNS TEXT
AS
$$
BEGIN
    RETURN str || ' Append numeric';
END;
$$ LANGUAGE plpgsql;
-- Cache plan invalidation -----------------
-- Do automatic cache plan invalidation on type change to ensure correct usage
DO
$$
    DECLARE
        t TEXT;
    BEGIN
        FOR i IN 1..10
            LOOP
                IF i % 2 = 1 THEN
                    SET @x := 10.5; -- numeric
                ELSE
                    SET @x := 'Ahoj'::TEXT;
                END IF;
                SELECT overloaded_text_numeric(@x) INTO t;
                RAISE NOTICE '%', t;
            END LOOP;
    END;
$$;
NOTICE:  10.5 Append numeric
NOTICE:  Ahoj Append text
NOTICE:  10.5 Append numeric
NOTICE:  Ahoj Append text
NOTICE:  10.5 Append numeric
NOTICE:  Ahoj Append text
NOTICE:  10.5 Append numeric
NOTICE:  Ahoj Append text
NOTICE:  10.5 Append numeric
NOTICE:  Ahoj Append text
DROP FUNCTION overloaded_text_numeric(str TEXT);
DROP FUNCTION overloaded_text_numeric(str NUMERIC);
-- SELECT ... INTO SESVAR ------------------
DO
$$
    DECLARE
        a INT;
    BEGIN
        SELECT '5s', 5.5, 3, 'TEST' COLLATE "POSIX", 'test' INTO @a, @b, a, @t1, @t2;

        RAISE NOTICE '% % % % %', @a, @b, a, @t1, @t2;
    END;
$$;
NOTICE:  5s 5.5 3 TEST test
-- test correct type and collation
SELECT @a, @b, @b * 2, @t1, @t2, @t1 < @t2;
 @a | @b  | ?column? | @t1  | @t2  | ?column? 
----+-----+----------+------+------+----------
 5s | 5.5 |     11.0 | TEST | test | t
(1 row)

DO
$$
    DECLARE
        a INT;
    BEGIN
        SELECT col_int, col_int, col_char
        INTO a, @a, @b
        FROM test;
    END;
$$;
SELECT @a, @b;
 @a | @b 
----+----
  5 | 5
(1 row)

DO
$$
    DECLARE
        a INT;
    BEGIN
        SELECT '5s', 5.5, 3, 'TEST' COLLATE "POSIX", 'test' INTO @a, @b, a, @t1, @t2;

        RAISE NOTICE '% % % % %', @a, @b, a, @t1, @t2;

        SELECT 5.5, 'Ahoj' INTO @a, @b; -- different type assignment
    END;
$$;
NOTICE:  5s 5.5 3 TEST test
SELECT @a * 2, @b, @t1, @t2, @t1 < @t2;
 ?column? |  @b  | @t1  | @t2  | ?column? 
----------+------+------+------+----------
     11.0 | Ahoj | TEST | test | t
(1 row)

SET @existing := 'Test';
DO -- self assigning
$$
    BEGIN
        SELECT @existing, @existing || ' 2' INTO @existing, @existing;
    END;
$$;
SELECT @existing;
 @existing 
-----------
 Test 2
(1 row)

DO -- should fail
$$
    DECLARE
        a INT;
    BEGIN
        SELECT col_int, col_int, col_char
        INTO STRICT a, @x, @y
        FROM test;
    END;
$$;
ERROR:  query returned more than one row
HINT:  Make sure the query returns a single row, or use LIMIT 1.
CONTEXT:  PL/pgSQL function inline_code_block line 5 at SQL statement
SELECT @x, @y; -- should fail
ERROR:  session variable "@y" does not exist
-- EXECUTE ---------------------------------
DO
$$
    BEGIN
        EXECUTE FORMAT('SELECT $1 || @a') USING @existing INTO @existing;

        RAISE NOTICE '%', @existing;
    END;
$$;
NOTICE:  Test 25.5
SET @existing := 'Test';
DO
$$
    DECLARE
        res TEXT;
    BEGIN
        EXECUTE 'SELECT @existing := 5' INTO res;

        RAISE NOTICE '%', res;
    END;
$$;
NOTICE:  5
SELECT @existing;
 @existing 
-----------
         5
(1 row)

-- Clean -----------------------------------
DROP TABLE test;
